No.     Time           Source                Destination           Protocol Length Info
      1 0.000000       192.168.1.1           224.0.0.1             IGMPv2   42     Membership Query, general

Frame 1: 42 bytes on wire (336 bits), 42 bytes captured (336 bits) on interface 0
Ethernet II, Src: Sfr_38:94:f0 (e4:5d:51:38:94:f0), Dst: IPv4mcast_01 (01:00:5e:00:00:01)
Internet Protocol Version 4, Src: 192.168.1.1, Dst: 224.0.0.1
Internet Group Management Protocol

No.     Time           Source                Destination           Protocol Length Info
      2 0.001092       172.16.255.254        224.0.0.1             IGMPv2   42     Membership Query, general

Frame 2: 42 bytes on wire (336 bits), 42 bytes captured (336 bits) on interface 0
Ethernet II, Src: Sfr_38:94:f0 (e4:5d:51:38:94:f0), Dst: IPv4mcast_01 (01:00:5e:00:00:01)
Internet Protocol Version 4, Src: 172.16.255.254, Dst: 224.0.0.1
Internet Group Management Protocol

No.     Time           Source                Destination           Protocol Length Info
      3 0.126595       216.58.206.237        192.168.1.32          TLSv1.2  109    Application Data

Frame 3: 109 bytes on wire (872 bits), 109 bytes captured (872 bits) on interface 0
Ethernet II, Src: Sfr_38:94:f0 (e4:5d:51:38:94:f0), Dst: HonHaiPr_30:62:c9 (68:94:23:30:62:c9)
Internet Protocol Version 4, Src: 216.58.206.237, Dst: 192.168.1.32
Transmission Control Protocol, Src Port: 443, Dst Port: 60298, Seq: 1, Ack: 1, Len: 55
Secure Sockets Layer

No.     Time           Source                Destination           Protocol Length Info
      4 0.127092       216.58.206.237        192.168.1.32          TCP      54     443 → 60298 [FIN, ACK] Seq=56 Ack=1 Win=187 Len=0

Frame 4: 54 bytes on wire (432 bits), 54 bytes captured (432 bits) on interface 0
Ethernet II, Src: Sfr_38:94:f0 (e4:5d:51:38:94:f0), Dst: HonHaiPr_30:62:c9 (68:94:23:30:62:c9)
Internet Protocol Version 4, Src: 216.58.206.237, Dst: 192.168.1.32
Transmission Control Protocol, Src Port: 443, Dst Port: 60298, Seq: 56, Ack: 1, Len: 0

No.     Time           Source                Destination           Protocol Length Info
      5 0.127470       192.168.1.32          216.58.206.237        TCP      54     60298 → 443 [FIN, ACK] Seq=1 Ack=57 Win=254 Len=0

Frame 5: 54 bytes on wire (432 bits), 54 bytes captured (432 bits) on interface 0
Ethernet II, Src: HonHaiPr_30:62:c9 (68:94:23:30:62:c9), Dst: Sfr_38:94:f0 (e4:5d:51:38:94:f0)
Internet Protocol Version 4, Src: 192.168.1.32, Dst: 216.58.206.237
Transmission Control Protocol, Src Port: 60298, Dst Port: 443, Seq: 1, Ack: 57, Len: 0

No.     Time           Source                Destination           Protocol Length Info
      6 0.137418       216.58.206.237        192.168.1.32          TCP      54     443 → 60298 [ACK] Seq=57 Ack=2 Win=187 Len=0

Frame 6: 54 bytes on wire (432 bits), 54 bytes captured (432 bits) on interface 0
Ethernet II, Src: Sfr_38:94:f0 (e4:5d:51:38:94:f0), Dst: HonHaiPr_30:62:c9 (68:94:23:30:62:c9)
Internet Protocol Version 4, Src: 216.58.206.237, Dst: 192.168.1.32
Transmission Control Protocol, Src Port: 443, Dst Port: 60298, Seq: 57, Ack: 2, Len: 0

No.     Time           Source                Destination           Protocol Length Info
      7 0.325747       192.168.1.32          216.58.201.226        TCP      55     60300 → 80 [ACK] Seq=1 Ack=1 Win=255 Len=1

Frame 7: 55 bytes on wire (440 bits), 55 bytes captured (440 bits) on interface 0
Ethernet II, Src: HonHaiPr_30:62:c9 (68:94:23:30:62:c9), Dst: Sfr_38:94:f0 (e4:5d:51:38:94:f0)
Internet Protocol Version 4, Src: 192.168.1.32, Dst: 216.58.201.226
Transmission Control Protocol, Src Port: 60300, Dst Port: 80, Seq: 1, Ack: 1, Len: 1

No.     Time           Source                Destination           Protocol Length Info
      8 0.331911       216.58.201.226        192.168.1.32          TCP      66     80 → 60300 [ACK] Seq=1 Ack=2 Win=180 Len=0 SLE=1 SRE=2

Frame 8: 66 bytes on wire (528 bits), 66 bytes captured (528 bits) on interface 0
Ethernet II, Src: Sfr_38:94:f0 (e4:5d:51:38:94:f0), Dst: HonHaiPr_30:62:c9 (68:94:23:30:62:c9)
Internet Protocol Version 4, Src: 216.58.201.226, Dst: 192.168.1.32
Transmission Control Protocol, Src Port: 80, Dst Port: 60300, Seq: 1, Ack: 2, Len: 0

No.     Time           Source                Destination           Protocol Length Info
      9 0.601200       192.30.253.116        192.168.1.32          TLSv1.2  85     Encrypted Alert

Frame 9: 85 bytes on wire (680 bits), 85 bytes captured (680 bits) on interface 0
Ethernet II, Src: Sfr_38:94:f0 (e4:5d:51:38:94:f0), Dst: HonHaiPr_30:62:c9 (68:94:23:30:62:c9)
Internet Protocol Version 4, Src: 192.30.253.116, Dst: 192.168.1.32
Transmission Control Protocol, Src Port: 443, Dst Port: 60349, Seq: 1, Ack: 1, Len: 31
Secure Sockets Layer

No.     Time           Source                Destination           Protocol Length Info
     10 0.601719       192.30.253.116        192.168.1.32          TCP      54     443 → 60349 [FIN, ACK] Seq=32 Ack=1 Win=31 Len=0

Frame 10: 54 bytes on wire (432 bits), 54 bytes captured (432 bits) on interface 0
Ethernet II, Src: Sfr_38:94:f0 (e4:5d:51:38:94:f0), Dst: HonHaiPr_30:62:c9 (68:94:23:30:62:c9)
Internet Protocol Version 4, Src: 192.30.253.116, Dst: 192.168.1.32
Transmission Control Protocol, Src Port: 443, Dst Port: 60349, Seq: 32, Ack: 1, Len: 0

No.     Time           Source                Destination           Protocol Length Info
     11 0.602013       192.168.1.32          192.30.253.116        TCP      54     60349 → 443 [ACK] Seq=1 Ack=33 Win=257 Len=0

Frame 11: 54 bytes on wire (432 bits), 54 bytes captured (432 bits) on interface 0
Ethernet II, Src: HonHaiPr_30:62:c9 (68:94:23:30:62:c9), Dst: Sfr_38:94:f0 (e4:5d:51:38:94:f0)
Internet Protocol Version 4, Src: 192.168.1.32, Dst: 192.30.253.116
Transmission Control Protocol, Src Port: 60349, Dst Port: 443, Seq: 1, Ack: 33, Len: 0

No.     Time           Source                Destination           Protocol Length Info
     12 0.921522       192.168.1.90          239.255.255.250       IGMPv2   46     Membership Report group 239.255.255.250

Frame 12: 46 bytes on wire (368 bits), 46 bytes captured (368 bits) on interface 0
Ethernet II, Src: HonHaiPr_f3:fc:6d (74:29:af:f3:fc:6d), Dst: IPv4mcast_7f:ff:fa (01:00:5e:7f:ff:fa)
Internet Protocol Version 4, Src: 192.168.1.90, Dst: 239.255.255.250
Internet Group Management Protocol

No.     Time           Source                Destination           Protocol Length Info
     13 2.346413       192.168.1.32          104.244.46.167        SSL      55     Continuation Data

Frame 13: 55 bytes on wire (440 bits), 55 bytes captured (440 bits) on interface 0
Ethernet II, Src: HonHaiPr_30:62:c9 (68:94:23:30:62:c9), Dst: Sfr_38:94:f0 (e4:5d:51:38:94:f0)
Internet Protocol Version 4, Src: 192.168.1.32, Dst: 104.244.46.167
Transmission Control Protocol, Src Port: 60310, Dst Port: 443, Seq: 1, Ack: 1, Len: 1
Secure Sockets Layer

No.     Time           Source                Destination           Protocol Length Info
     14 2.367559       104.244.46.167        192.168.1.32          TCP      66     443 → 60310 [ACK] Seq=1 Ack=2 Win=62 Len=0 SLE=1 SRE=2

Frame 14: 66 bytes on wire (528 bits), 66 bytes captured (528 bits) on interface 0
Ethernet II, Src: Sfr_38:94:f0 (e4:5d:51:38:94:f0), Dst: HonHaiPr_30:62:c9 (68:94:23:30:62:c9)
Internet Protocol Version 4, Src: 104.244.46.167, Dst: 192.168.1.32
Transmission Control Protocol, Src Port: 443, Dst Port: 60310, Seq: 1, Ack: 2, Len: 0

No.     Time           Source                Destination           Protocol Length Info
     15 2.436467       192.168.1.32          104.244.46.231        SSL      55     Continuation Data

Frame 15: 55 bytes on wire (440 bits), 55 bytes captured (440 bits) on interface 0
Ethernet II, Src: HonHaiPr_30:62:c9 (68:94:23:30:62:c9), Dst: Sfr_38:94:f0 (e4:5d:51:38:94:f0)
Internet Protocol Version 4, Src: 192.168.1.32, Dst: 104.244.46.231
Transmission Control Protocol, Src Port: 60323, Dst Port: 443, Seq: 1, Ack: 1, Len: 1
Secure Sockets Layer

No.     Time           Source                Destination           Protocol Length Info
     16 2.463748       104.244.46.231        192.168.1.32          TCP      66     443 → 60323 [ACK] Seq=1 Ack=2 Win=58 Len=0 SLE=1 SRE=2

Frame 16: 66 bytes on wire (528 bits), 66 bytes captured (528 bits) on interface 0
Ethernet II, Src: Sfr_38:94:f0 (e4:5d:51:38:94:f0), Dst: HonHaiPr_30:62:c9 (68:94:23:30:62:c9)
Internet Protocol Version 4, Src: 104.244.46.231, Dst: 192.168.1.32
Transmission Control Protocol, Src Port: 443, Dst Port: 60323, Seq: 1, Ack: 2, Len: 0

No.     Time           Source                Destination           Protocol Length Info
     17 2.521427       192.168.1.32          104.244.46.231        SSL      55     Continuation Data

Frame 17: 55 bytes on wire (440 bits), 55 bytes captured (440 bits) on interface 0
Ethernet II, Src: HonHaiPr_30:62:c9 (68:94:23:30:62:c9), Dst: Sfr_38:94:f0 (e4:5d:51:38:94:f0)
Internet Protocol Version 4, Src: 192.168.1.32, Dst: 104.244.46.231
Transmission Control Protocol, Src Port: 60322, Dst Port: 443, Seq: 1, Ack: 1, Len: 1
Secure Sockets Layer

No.     Time           Source                Destination           Protocol Length Info
     18 2.543582       104.244.46.231        192.168.1.32          TCP      66     443 → 60322 [ACK] Seq=1 Ack=2 Win=62 Len=0 SLE=1 SRE=2

Frame 18: 66 bytes on wire (528 bits), 66 bytes captured (528 bits) on interface 0
Ethernet II, Src: Sfr_38:94:f0 (e4:5d:51:38:94:f0), Dst: HonHaiPr_30:62:c9 (68:94:23:30:62:c9)
Internet Protocol Version 4, Src: 104.244.46.231, Dst: 192.168.1.32
Transmission Control Protocol, Src Port: 443, Dst Port: 60322, Seq: 1, Ack: 2, Len: 0

No.     Time           Source                Destination           Protocol Length Info
     19 2.681757       192.168.1.32          224.0.0.252           IGMPv2   46     Membership Report group 224.0.0.252

Frame 19: 46 bytes on wire (368 bits), 46 bytes captured (368 bits) on interface 0
Ethernet II, Src: HonHaiPr_30:62:c9 (68:94:23:30:62:c9), Dst: IPv4mcast_fc (01:00:5e:00:00:fc)
Internet Protocol Version 4, Src: 192.168.1.32, Dst: 224.0.0.252
Internet Group Management Protocol

No.     Time           Source                Destination           Protocol Length Info
     20 5.728296       192.168.1.32          62.216.247.227        SSL      55     Continuation Data

Frame 20: 55 bytes on wire (440 bits), 55 bytes captured (440 bits) on interface 0
Ethernet II, Src: HonHaiPr_30:62:c9 (68:94:23:30:62:c9), Dst: Sfr_38:94:f0 (e4:5d:51:38:94:f0)
Internet Protocol Version 4, Src: 192.168.1.32, Dst: 62.216.247.227
Transmission Control Protocol, Src Port: 60327, Dst Port: 443, Seq: 1, Ack: 1, Len: 1
Secure Sockets Layer

No.     Time           Source                Destination           Protocol Length Info
     21 5.752998       62.216.247.227        192.168.1.32          TCP      54     443 → 60327 [ACK] Seq=1 Ack=2 Win=5492 Len=0

Frame 21: 54 bytes on wire (432 bits), 54 bytes captured (432 bits) on interface 0
Ethernet II, Src: Sfr_38:94:f0 (e4:5d:51:38:94:f0), Dst: HonHaiPr_30:62:c9 (68:94:23:30:62:c9)
Internet Protocol Version 4, Src: 62.216.247.227, Dst: 192.168.1.32
Transmission Control Protocol, Src Port: 443, Dst Port: 60327, Seq: 1, Ack: 2, Len: 0

No.     Time           Source                Destination           Protocol Length Info
     22 5.848582       192.168.1.32          185.29.133.208        SSL      55     Continuation Data

Frame 22: 55 bytes on wire (440 bits), 55 bytes captured (440 bits) on interface 0
Ethernet II, Src: HonHaiPr_30:62:c9 (68:94:23:30:62:c9), Dst: Sfr_38:94:f0 (e4:5d:51:38:94:f0)
Internet Protocol Version 4, Src: 192.168.1.32, Dst: 185.29.133.208
Transmission Control Protocol, Src Port: 60326, Dst Port: 443, Seq: 1, Ack: 1, Len: 1
Secure Sockets Layer

No.     Time           Source                Destination           Protocol Length Info
     23 5.876230       185.29.133.208        192.168.1.32          TCP      66     443 → 60326 [ACK] Seq=1 Ack=2 Win=63 Len=0 SLE=1 SRE=2

Frame 23: 66 bytes on wire (528 bits), 66 bytes captured (528 bits) on interface 0
Ethernet II, Src: Sfr_38:94:f0 (e4:5d:51:38:94:f0), Dst: HonHaiPr_30:62:c9 (68:94:23:30:62:c9)
Internet Protocol Version 4, Src: 185.29.133.208, Dst: 192.168.1.32
Transmission Control Protocol, Src Port: 443, Dst Port: 60326, Seq: 1, Ack: 2, Len: 0

No.     Time           Source                Destination           Protocol Length Info
     24 6.385953       192.168.1.32          151.101.2.49          SSL      55     Continuation Data

Frame 24: 55 bytes on wire (440 bits), 55 bytes captured (440 bits) on interface 0
Ethernet II, Src: HonHaiPr_30:62:c9 (68:94:23:30:62:c9), Dst: Sfr_38:94:f0 (e4:5d:51:38:94:f0)
Internet Protocol Version 4, Src: 192.168.1.32, Dst: 151.101.2.49
Transmission Control Protocol, Src Port: 60328, Dst Port: 443, Seq: 1, Ack: 1, Len: 1
Secure Sockets Layer

No.     Time           Source                Destination           Protocol Length Info
     25 6.405480       151.101.2.49          192.168.1.32          TCP      66     443 → 60328 [ACK] Seq=1 Ack=2 Win=59 Len=0 SLE=1 SRE=2

Frame 25: 66 bytes on wire (528 bits), 66 bytes captured (528 bits) on interface 0
Ethernet II, Src: Sfr_38:94:f0 (e4:5d:51:38:94:f0), Dst: HonHaiPr_30:62:c9 (68:94:23:30:62:c9)
Internet Protocol Version 4, Src: 151.101.2.49, Dst: 192.168.1.32
Transmission Control Protocol, Src Port: 443, Dst Port: 60328, Seq: 1, Ack: 2, Len: 0

No.     Time           Source                Destination           Protocol Length Info
     26 8.374843       192.168.1.32          104.124.202.125       TCP      55     60317 → 80 [ACK] Seq=1 Ack=1 Win=253 Len=1

Frame 26: 55 bytes on wire (440 bits), 55 bytes captured (440 bits) on interface 0
Ethernet II, Src: HonHaiPr_30:62:c9 (68:94:23:30:62:c9), Dst: Sfr_38:94:f0 (e4:5d:51:38:94:f0)
Internet Protocol Version 4, Src: 192.168.1.32, Dst: 104.124.202.125
Transmission Control Protocol, Src Port: 60317, Dst Port: 80, Seq: 1, Ack: 1, Len: 1

No.     Time           Source                Destination           Protocol Length Info
     27 8.381563       104.124.202.125       192.168.1.32          TCP      66     80 → 60317 [ACK] Seq=1 Ack=2 Win=986 Len=0 SLE=1 SRE=2

Frame 27: 66 bytes on wire (528 bits), 66 bytes captured (528 bits) on interface 0
Ethernet II, Src: Sfr_38:94:f0 (e4:5d:51:38:94:f0), Dst: HonHaiPr_30:62:c9 (68:94:23:30:62:c9)
Internet Protocol Version 4, Src: 104.124.202.125, Dst: 192.168.1.32
Transmission Control Protocol, Src Port: 80, Dst Port: 60317, Seq: 1, Ack: 2, Len: 0

No.     Time           Source                Destination           Protocol Length Info
     28 9.249161       216.58.206.238        192.168.1.32          TLSv1.2  109    Application Data

Frame 28: 109 bytes on wire (872 bits), 109 bytes captured (872 bits) on interface 0
Ethernet II, Src: Sfr_38:94:f0 (e4:5d:51:38:94:f0), Dst: HonHaiPr_30:62:c9 (68:94:23:30:62:c9)
Internet Protocol Version 4, Src: 216.58.206.238, Dst: 192.168.1.32
Transmission Control Protocol, Src Port: 443, Dst Port: 60262, Seq: 1, Ack: 1, Len: 55
Secure Sockets Layer

No.     Time           Source                Destination           Protocol Length Info
     29 9.249998       192.168.1.32          216.58.206.238        TCP      54     60262 → 443 [FIN, ACK] Seq=1 Ack=56 Win=256 Len=0

Frame 29: 54 bytes on wire (432 bits), 54 bytes captured (432 bits) on interface 0
Ethernet II, Src: HonHaiPr_30:62:c9 (68:94:23:30:62:c9), Dst: Sfr_38:94:f0 (e4:5d:51:38:94:f0)
Internet Protocol Version 4, Src: 192.168.1.32, Dst: 216.58.206.238
Transmission Control Protocol, Src Port: 60262, Dst Port: 443, Seq: 1, Ack: 56, Len: 0

No.     Time           Source                Destination           Protocol Length Info
     30 9.250535       216.58.206.238        192.168.1.32          TCP      54     443 → 60262 [FIN, ACK] Seq=56 Ack=1 Win=204 Len=0

Frame 30: 54 bytes on wire (432 bits), 54 bytes captured (432 bits) on interface 0
Ethernet II, Src: Sfr_38:94:f0 (e4:5d:51:38:94:f0), Dst: HonHaiPr_30:62:c9 (68:94:23:30:62:c9)
Internet Protocol Version 4, Src: 216.58.206.238, Dst: 192.168.1.32
Transmission Control Protocol, Src Port: 443, Dst Port: 60262, Seq: 56, Ack: 1, Len: 0

No.     Time           Source                Destination           Protocol Length Info
     31 9.250863       192.168.1.32          216.58.206.238        TCP      54     60262 → 443 [ACK] Seq=2 Ack=57 Win=256 Len=0

Frame 31: 54 bytes on wire (432 bits), 54 bytes captured (432 bits) on interface 0
Ethernet II, Src: HonHaiPr_30:62:c9 (68:94:23:30:62:c9), Dst: Sfr_38:94:f0 (e4:5d:51:38:94:f0)
Internet Protocol Version 4, Src: 192.168.1.32, Dst: 216.58.206.238
Transmission Control Protocol, Src Port: 60262, Dst Port: 443, Seq: 2, Ack: 57, Len: 0

No.     Time           Source                Destination           Protocol Length Info
     32 9.258705       216.58.206.238        192.168.1.32          TCP      54     443 → 60262 [ACK] Seq=57 Ack=2 Win=204 Len=0

Frame 32: 54 bytes on wire (432 bits), 54 bytes captured (432 bits) on interface 0
Ethernet II, Src: Sfr_38:94:f0 (e4:5d:51:38:94:f0), Dst: HonHaiPr_30:62:c9 (68:94:23:30:62:c9)
Internet Protocol Version 4, Src: 216.58.206.238, Dst: 192.168.1.32
Transmission Control Protocol, Src Port: 443, Dst Port: 60262, Seq: 57, Ack: 2, Len: 0

No.     Time           Source                Destination           Protocol Length Info
     33 9.526878       192.168.1.50          239.255.255.250       SSDP     497    NOTIFY * HTTP/1.1 

Frame 33: 497 bytes on wire (3976 bits), 497 bytes captured (3976 bits) on interface 0
Ethernet II, Src: Sfr_25:1a:80 (30:7e:cb:25:1a:80), Dst: IPv4mcast_7f:ff:fa (01:00:5e:7f:ff:fa)
Internet Protocol Version 4, Src: 192.168.1.50, Dst: 239.255.255.250
User Datagram Protocol, Src Port: 58994, Dst Port: 1900
Simple Service Discovery Protocol

No.     Time           Source                Destination           Protocol Length Info
     34 9.531448       192.168.1.50          239.255.255.250       SSDP     506    NOTIFY * HTTP/1.1 

Frame 34: 506 bytes on wire (4048 bits), 506 bytes captured (4048 bits) on interface 0
Ethernet II, Src: Sfr_25:1a:80 (30:7e:cb:25:1a:80), Dst: IPv4mcast_7f:ff:fa (01:00:5e:7f:ff:fa)
Internet Protocol Version 4, Src: 192.168.1.50, Dst: 239.255.255.250
User Datagram Protocol, Src Port: 58994, Dst Port: 1900
Simple Service Discovery Protocol

No.     Time           Source                Destination           Protocol Length Info
     35 9.536502       192.168.1.50          239.255.255.250       SSDP     539    NOTIFY * HTTP/1.1 

Frame 35: 539 bytes on wire (4312 bits), 539 bytes captured (4312 bits) on interface 0
Ethernet II, Src: Sfr_25:1a:80 (30:7e:cb:25:1a:80), Dst: IPv4mcast_7f:ff:fa (01:00:5e:7f:ff:fa)
Internet Protocol Version 4, Src: 192.168.1.50, Dst: 239.255.255.250
User Datagram Protocol, Src Port: 58994, Dst Port: 1900
Simple Service Discovery Protocol

No.     Time           Source                Destination           Protocol Length Info
     36 9.541835       192.168.1.50          239.255.255.250       SSDP     506    NOTIFY * HTTP/1.1 

Frame 36: 506 bytes on wire (4048 bits), 506 bytes captured (4048 bits) on interface 0
Ethernet II, Src: Sfr_25:1a:80 (30:7e:cb:25:1a:80), Dst: IPv4mcast_7f:ff:fa (01:00:5e:7f:ff:fa)
Internet Protocol Version 4, Src: 192.168.1.50, Dst: 239.255.255.250
User Datagram Protocol, Src Port: 37379, Dst Port: 1900
Simple Service Discovery Protocol

No.     Time           Source                Destination           Protocol Length Info
     37 9.546382       192.168.1.50          239.255.255.250       SSDP     547    NOTIFY * HTTP/1.1 

Frame 37: 547 bytes on wire (4376 bits), 547 bytes captured (4376 bits) on interface 0
Ethernet II, Src: Sfr_25:1a:80 (30:7e:cb:25:1a:80), Dst: IPv4mcast_7f:ff:fa (01:00:5e:7f:ff:fa)
Internet Protocol Version 4, Src: 192.168.1.50, Dst: 239.255.255.250
User Datagram Protocol, Src Port: 37379, Dst Port: 1900
Simple Service Discovery Protocol

No.     Time           Source                Destination           Protocol Length Info
     38 9.551209       192.168.1.50          239.255.255.250       SSDP     535    NOTIFY * HTTP/1.1 

Frame 38: 535 bytes on wire (4280 bits), 535 bytes captured (4280 bits) on interface 0
Ethernet II, Src: Sfr_25:1a:80 (30:7e:cb:25:1a:80), Dst: IPv4mcast_7f:ff:fa (01:00:5e:7f:ff:fa)
Internet Protocol Version 4, Src: 192.168.1.50, Dst: 239.255.255.250
User Datagram Protocol, Src Port: 41852, Dst Port: 1900
Simple Service Discovery Protocol

No.     Time           Source                Destination           Protocol Length Info
     39 9.556807       192.168.1.50          239.255.255.250       SSDP     506    NOTIFY * HTTP/1.1 

Frame 39: 506 bytes on wire (4048 bits), 506 bytes captured (4048 bits) on interface 0
Ethernet II, Src: Sfr_25:1a:80 (30:7e:cb:25:1a:80), Dst: IPv4mcast_7f:ff:fa (01:00:5e:7f:ff:fa)
Internet Protocol Version 4, Src: 192.168.1.50, Dst: 239.255.255.250
User Datagram Protocol, Src Port: 34573, Dst Port: 1900
Simple Service Discovery Protocol

No.     Time           Source                Destination           Protocol Length Info
     40 9.561967       192.168.1.50          239.255.255.250       SSDP     551    NOTIFY * HTTP/1.1 

Frame 40: 551 bytes on wire (4408 bits), 551 bytes captured (4408 bits) on interface 0
Ethernet II, Src: Sfr_25:1a:80 (30:7e:cb:25:1a:80), Dst: IPv4mcast_7f:ff:fa (01:00:5e:7f:ff:fa)
Internet Protocol Version 4, Src: 192.168.1.50, Dst: 239.255.255.250
User Datagram Protocol, Src Port: 34573, Dst Port: 1900
Simple Service Discovery Protocol

No.     Time           Source                Destination           Protocol Length Info
     41 9.566892       192.168.1.50          239.255.255.250       SSDP     541    NOTIFY * HTTP/1.1 

Frame 41: 541 bytes on wire (4328 bits), 541 bytes captured (4328 bits) on interface 0
Ethernet II, Src: Sfr_25:1a:80 (30:7e:cb:25:1a:80), Dst: IPv4mcast_7f:ff:fa (01:00:5e:7f:ff:fa)
Internet Protocol Version 4, Src: 192.168.1.50, Dst: 239.255.255.250
User Datagram Protocol, Src Port: 39468, Dst Port: 1900
Simple Service Discovery Protocol

No.     Time           Source                Destination           Protocol Length Info
     42 9.571594       192.168.1.50          239.255.255.250       SSDP     497    NOTIFY * HTTP/1.1 

Frame 42: 497 bytes on wire (3976 bits), 497 bytes captured (3976 bits) on interface 0
Ethernet II, Src: Sfr_25:1a:80 (30:7e:cb:25:1a:80), Dst: IPv4mcast_7f:ff:fa (01:00:5e:7f:ff:fa)
Internet Protocol Version 4, Src: 192.168.1.50, Dst: 239.255.255.250
User Datagram Protocol, Src Port: 43332, Dst Port: 1900
Simple Service Discovery Protocol

No.     Time           Source                Destination           Protocol Length Info
     43 9.576327       192.168.1.50          239.255.255.250       SSDP     506    NOTIFY * HTTP/1.1 

Frame 43: 506 bytes on wire (4048 bits), 506 bytes captured (4048 bits) on interface 0
Ethernet II, Src: Sfr_25:1a:80 (30:7e:cb:25:1a:80), Dst: IPv4mcast_7f:ff:fa (01:00:5e:7f:ff:fa)
Internet Protocol Version 4, Src: 192.168.1.50, Dst: 239.255.255.250
User Datagram Protocol, Src Port: 43332, Dst Port: 1900
Simple Service Discovery Protocol

No.     Time           Source                Destination           Protocol Length Info
     44 9.581188       192.168.1.50          239.255.255.250       SSDP     539    NOTIFY * HTTP/1.1 

Frame 44: 539 bytes on wire (4312 bits), 539 bytes captured (4312 bits) on interface 0
Ethernet II, Src: Sfr_25:1a:80 (30:7e:cb:25:1a:80), Dst: IPv4mcast_7f:ff:fa (01:00:5e:7f:ff:fa)
Internet Protocol Version 4, Src: 192.168.1.50, Dst: 239.255.255.250
User Datagram Protocol, Src Port: 43332, Dst Port: 1900
Simple Service Discovery Protocol

No.     Time           Source                Destination           Protocol Length Info
     45 9.586022       192.168.1.50          239.255.255.250       SSDP     506    NOTIFY * HTTP/1.1 

Frame 45: 506 bytes on wire (4048 bits), 506 bytes captured (4048 bits) on interface 0
Ethernet II, Src: Sfr_25:1a:80 (30:7e:cb:25:1a:80), Dst: IPv4mcast_7f:ff:fa (01:00:5e:7f:ff:fa)
Internet Protocol Version 4, Src: 192.168.1.50, Dst: 239.255.255.250
User Datagram Protocol, Src Port: 45105, Dst Port: 1900
Simple Service Discovery Protocol

No.     Time           Source                Destination           Protocol Length Info
     46 9.590938       192.168.1.50          239.255.255.250       SSDP     547    NOTIFY * HTTP/1.1 

Frame 46: 547 bytes on wire (4376 bits), 547 bytes captured (4376 bits) on interface 0
Ethernet II, Src: Sfr_25:1a:80 (30:7e:cb:25:1a:80), Dst: IPv4mcast_7f:ff:fa (01:00:5e:7f:ff:fa)
Internet Protocol Version 4, Src: 192.168.1.50, Dst: 239.255.255.250
User Datagram Protocol, Src Port: 45105, Dst Port: 1900
Simple Service Discovery Protocol

No.     Time           Source                Destination           Protocol Length Info
     47 9.597434       192.168.1.50          239.255.255.250       SSDP     535    NOTIFY * HTTP/1.1 

Frame 47: 535 bytes on wire (4280 bits), 535 bytes captured (4280 bits) on interface 0
Ethernet II, Src: Sfr_25:1a:80 (30:7e:cb:25:1a:80), Dst: IPv4mcast_7f:ff:fa (01:00:5e:7f:ff:fa)
Internet Protocol Version 4, Src: 192.168.1.50, Dst: 239.255.255.250
User Datagram Protocol, Src Port: 36334, Dst Port: 1900
Simple Service Discovery Protocol

No.     Time           Source                Destination           Protocol Length Info
     48 9.600731       192.168.1.50          239.255.255.250       SSDP     506    NOTIFY * HTTP/1.1 

Frame 48: 506 bytes on wire (4048 bits), 506 bytes captured (4048 bits) on interface 0
Ethernet II, Src: Sfr_25:1a:80 (30:7e:cb:25:1a:80), Dst: IPv4mcast_7f:ff:fa (01:00:5e:7f:ff:fa)
Internet Protocol Version 4, Src: 192.168.1.50, Dst: 239.255.255.250
User Datagram Protocol, Src Port: 40267, Dst Port: 1900
Simple Service Discovery Protocol

No.     Time           Source                Destination           Protocol Length Info
     49 9.607037       192.168.1.50          239.255.255.250       SSDP     551    NOTIFY * HTTP/1.1 

Frame 49: 551 bytes on wire (4408 bits), 551 bytes captured (4408 bits) on interface 0
Ethernet II, Src: Sfr_25:1a:80 (30:7e:cb:25:1a:80), Dst: IPv4mcast_7f:ff:fa (01:00:5e:7f:ff:fa)
Internet Protocol Version 4, Src: 192.168.1.50, Dst: 239.255.255.250
User Datagram Protocol, Src Port: 40267, Dst Port: 1900
Simple Service Discovery Protocol

No.     Time           Source                Destination           Protocol Length Info
     50 9.611933       192.168.1.50          239.255.255.250       SSDP     541    NOTIFY * HTTP/1.1 

Frame 50: 541 bytes on wire (4328 bits), 541 bytes captured (4328 bits) on interface 0
Ethernet II, Src: Sfr_25:1a:80 (30:7e:cb:25:1a:80), Dst: IPv4mcast_7f:ff:fa (01:00:5e:7f:ff:fa)
Internet Protocol Version 4, Src: 192.168.1.50, Dst: 239.255.255.250
User Datagram Protocol, Src Port: 58149, Dst Port: 1900
Simple Service Discovery Protocol

No.     Time           Source                Destination           Protocol Length Info
     51 9.626810       192.168.1.32          104.124.202.125       SSL      55     Continuation Data

Frame 51: 55 bytes on wire (440 bits), 55 bytes captured (440 bits) on interface 0
Ethernet II, Src: HonHaiPr_30:62:c9 (68:94:23:30:62:c9), Dst: Sfr_38:94:f0 (e4:5d:51:38:94:f0)
Internet Protocol Version 4, Src: 192.168.1.32, Dst: 104.124.202.125
Transmission Control Protocol, Src Port: 60342, Dst Port: 443, Seq: 1, Ack: 1, Len: 1
Secure Sockets Layer

No.     Time           Source                Destination           Protocol Length Info
     52 9.634122       104.124.202.125       192.168.1.32          TCP      66     443 → 60342 [ACK] Seq=1 Ack=2 Win=982 Len=0 SLE=1 SRE=2

Frame 52: 66 bytes on wire (528 bits), 66 bytes captured (528 bits) on interface 0
Ethernet II, Src: Sfr_38:94:f0 (e4:5d:51:38:94:f0), Dst: HonHaiPr_30:62:c9 (68:94:23:30:62:c9)
Internet Protocol Version 4, Src: 104.124.202.125, Dst: 192.168.1.32
Transmission Control Protocol, Src Port: 443, Dst Port: 60342, Seq: 1, Ack: 2, Len: 0

No.     Time           Source                Destination           Protocol Length Info
     53 9.767111       fe80::1401:8b8c:139a:2146 ff02::1:2             DHCPv6   149    Solicit XID: 0x6125d3 CID: 0001000119f7b0186894233062c9 

Frame 53: 149 bytes on wire (1192 bits), 149 bytes captured (1192 bits) on interface 0
Ethernet II, Src: HonHaiPr_30:62:c9 (68:94:23:30:62:c9), Dst: IPv6mcast_01:00:02 (33:33:00:01:00:02)
Internet Protocol Version 6, Src: fe80::1401:8b8c:139a:2146, Dst: ff02::1:2
User Datagram Protocol, Src Port: 546, Dst Port: 547
DHCPv6

No.     Time           Source                Destination           Protocol Length Info
     54 9.802367       216.58.206.238        192.168.1.32          TLSv1.2  109    Application Data

Frame 54: 109 bytes on wire (872 bits), 109 bytes captured (872 bits) on interface 0
Ethernet II, Src: Sfr_38:94:f0 (e4:5d:51:38:94:f0), Dst: HonHaiPr_30:62:c9 (68:94:23:30:62:c9)
Internet Protocol Version 4, Src: 216.58.206.238, Dst: 192.168.1.32
Transmission Control Protocol, Src Port: 443, Dst Port: 60286, Seq: 1, Ack: 1, Len: 55
Secure Sockets Layer

No.     Time           Source                Destination           Protocol Length Info
     55 9.802810       216.58.206.238        192.168.1.32          TCP      54     443 → 60286 [FIN, ACK] Seq=56 Ack=1 Win=184 Len=0

Frame 55: 54 bytes on wire (432 bits), 54 bytes captured (432 bits) on interface 0
Ethernet II, Src: Sfr_38:94:f0 (e4:5d:51:38:94:f0), Dst: HonHaiPr_30:62:c9 (68:94:23:30:62:c9)
Internet Protocol Version 4, Src: 216.58.206.238, Dst: 192.168.1.32
Transmission Control Protocol, Src Port: 443, Dst Port: 60286, Seq: 56, Ack: 1, Len: 0

No.     Time           Source                Destination           Protocol Length Info
     56 9.803079       192.168.1.32          216.58.206.238        TCP      54     60286 → 443 [ACK] Seq=1 Ack=57 Win=257 Len=0

Frame 56: 54 bytes on wire (432 bits), 54 bytes captured (432 bits) on interface 0
Ethernet II, Src: HonHaiPr_30:62:c9 (68:94:23:30:62:c9), Dst: Sfr_38:94:f0 (e4:5d:51:38:94:f0)
Internet Protocol Version 4, Src: 192.168.1.32, Dst: 216.58.206.238
Transmission Control Protocol, Src Port: 60286, Dst Port: 443, Seq: 1, Ack: 57, Len: 0

No.     Time           Source                Destination           Protocol Length Info
     57 9.803990       192.168.1.32          216.58.206.238        TCP      54     60286 → 443 [FIN, ACK] Seq=1 Ack=57 Win=257 Len=0

Frame 57: 54 bytes on wire (432 bits), 54 bytes captured (432 bits) on interface 0
Ethernet II, Src: HonHaiPr_30:62:c9 (68:94:23:30:62:c9), Dst: Sfr_38:94:f0 (e4:5d:51:38:94:f0)
Internet Protocol Version 4, Src: 192.168.1.32, Dst: 216.58.206.238
Transmission Control Protocol, Src Port: 60286, Dst Port: 443, Seq: 1, Ack: 57, Len: 0

No.     Time           Source                Destination           Protocol Length Info
     58 9.814337       216.58.206.238        192.168.1.32          TCP      54     443 → 60286 [ACK] Seq=57 Ack=2 Win=184 Len=0

Frame 58: 54 bytes on wire (432 bits), 54 bytes captured (432 bits) on interface 0
Ethernet II, Src: Sfr_38:94:f0 (e4:5d:51:38:94:f0), Dst: HonHaiPr_30:62:c9 (68:94:23:30:62:c9)
Internet Protocol Version 4, Src: 216.58.206.238, Dst: 192.168.1.32
Transmission Control Protocol, Src Port: 443, Dst Port: 60286, Seq: 57, Ack: 2, Len: 0

No.     Time           Source                Destination           Protocol Length Info
     59 9.834006       192.168.1.50          239.255.255.250       SSDP     497    NOTIFY * HTTP/1.1 

Frame 59: 497 bytes on wire (3976 bits), 497 bytes captured (3976 bits) on interface 0
Ethernet II, Src: Sfr_25:1a:80 (30:7e:cb:25:1a:80), Dst: IPv4mcast_7f:ff:fa (01:00:5e:7f:ff:fa)
Internet Protocol Version 4, Src: 192.168.1.50, Dst: 239.255.255.250
User Datagram Protocol, Src Port: 44725, Dst Port: 1900
Simple Service Discovery Protocol

No.     Time           Source                Destination           Protocol Length Info
     60 9.838641       192.168.1.50          239.255.255.250       SSDP     506    NOTIFY * HTTP/1.1 

Frame 60: 506 bytes on wire (4048 bits), 506 bytes captured (4048 bits) on interface 0
Ethernet II, Src: Sfr_25:1a:80 (30:7e:cb:25:1a:80), Dst: IPv4mcast_7f:ff:fa (01:00:5e:7f:ff:fa)
Internet Protocol Version 4, Src: 192.168.1.50, Dst: 239.255.255.250
User Datagram Protocol, Src Port: 44725, Dst Port: 1900
Simple Service Discovery Protocol

No.     Time           Source                Destination           Protocol Length Info
     61 9.843656       192.168.1.50          239.255.255.250       SSDP     539    NOTIFY * HTTP/1.1 

Frame 61: 539 bytes on wire (4312 bits), 539 bytes captured (4312 bits) on interface 0
Ethernet II, Src: Sfr_25:1a:80 (30:7e:cb:25:1a:80), Dst: IPv4mcast_7f:ff:fa (01:00:5e:7f:ff:fa)
Internet Protocol Version 4, Src: 192.168.1.50, Dst: 239.255.255.250
User Datagram Protocol, Src Port: 44725, Dst Port: 1900
Simple Service Discovery Protocol

No.     Time           Source                Destination           Protocol Length Info
     62 9.848526       192.168.1.50          239.255.255.250       SSDP     506    NOTIFY * HTTP/1.1 

Frame 62: 506 bytes on wire (4048 bits), 506 bytes captured (4048 bits) on interface 0
Ethernet II, Src: Sfr_25:1a:80 (30:7e:cb:25:1a:80), Dst: IPv4mcast_7f:ff:fa (01:00:5e:7f:ff:fa)
Internet Protocol Version 4, Src: 192.168.1.50, Dst: 239.255.255.250
User Datagram Protocol, Src Port: 35159, Dst Port: 1900
Simple Service Discovery Protocol

No.     Time           Source                Destination           Protocol Length Info
     63 9.853538       192.168.1.50          239.255.255.250       SSDP     547    NOTIFY * HTTP/1.1 

Frame 63: 547 bytes on wire (4376 bits), 547 bytes captured (4376 bits) on interface 0
Ethernet II, Src: Sfr_25:1a:80 (30:7e:cb:25:1a:80), Dst: IPv4mcast_7f:ff:fa (01:00:5e:7f:ff:fa)
Internet Protocol Version 4, Src: 192.168.1.50, Dst: 239.255.255.250
User Datagram Protocol, Src Port: 35159, Dst Port: 1900
Simple Service Discovery Protocol

No.     Time           Source                Destination           Protocol Length Info
     64 9.861220       192.168.1.50          239.255.255.250       SSDP     535    NOTIFY * HTTP/1.1 

Frame 64: 535 bytes on wire (4280 bits), 535 bytes captured (4280 bits) on interface 0
Ethernet II, Src: Sfr_25:1a:80 (30:7e:cb:25:1a:80), Dst: IPv4mcast_7f:ff:fa (01:00:5e:7f:ff:fa)
Internet Protocol Version 4, Src: 192.168.1.50, Dst: 239.255.255.250
User Datagram Protocol, Src Port: 56114, Dst Port: 1900
Simple Service Discovery Protocol

No.     Time           Source                Destination           Protocol Length Info
     65 9.863528       192.168.1.50          239.255.255.250       SSDP     506    NOTIFY * HTTP/1.1 

Frame 65: 506 bytes on wire (4048 bits), 506 bytes captured (4048 bits) on interface 0
Ethernet II, Src: Sfr_25:1a:80 (30:7e:cb:25:1a:80), Dst: IPv4mcast_7f:ff:fa (01:00:5e:7f:ff:fa)
Internet Protocol Version 4, Src: 192.168.1.50, Dst: 239.255.255.250
User Datagram Protocol, Src Port: 54923, Dst Port: 1900
Simple Service Discovery Protocol

No.     Time           Source                Destination           Protocol Length Info
     66 9.868011       192.168.1.50          239.255.255.250       SSDP     551    NOTIFY * HTTP/1.1 

Frame 66: 551 bytes on wire (4408 bits), 551 bytes captured (4408 bits) on interface 0
Ethernet II, Src: Sfr_25:1a:80 (30:7e:cb:25:1a:80), Dst: IPv4mcast_7f:ff:fa (01:00:5e:7f:ff:fa)
Internet Protocol Version 4, Src: 192.168.1.50, Dst: 239.255.255.250
User Datagram Protocol, Src Port: 54923, Dst Port: 1900
Simple Service Discovery Protocol

No.     Time           Source                Destination           Protocol Length Info
     67 9.873534       192.168.1.50          239.255.255.250       SSDP     541    NOTIFY * HTTP/1.1 

Frame 67: 541 bytes on wire (4328 bits), 541 bytes captured (4328 bits) on interface 0
Ethernet II, Src: Sfr_25:1a:80 (30:7e:cb:25:1a:80), Dst: IPv4mcast_7f:ff:fa (01:00:5e:7f:ff:fa)
Internet Protocol Version 4, Src: 192.168.1.50, Dst: 239.255.255.250
User Datagram Protocol, Src Port: 47636, Dst Port: 1900
Simple Service Discovery Protocol

No.     Time           Source                Destination           Protocol Length Info
     68 9.881128       192.168.1.50          239.255.255.250       SSDP     497    NOTIFY * HTTP/1.1 

Frame 68: 497 bytes on wire (3976 bits), 497 bytes captured (3976 bits) on interface 0
Ethernet II, Src: Sfr_25:1a:80 (30:7e:cb:25:1a:80), Dst: IPv4mcast_7f:ff:fa (01:00:5e:7f:ff:fa)
Internet Protocol Version 4, Src: 192.168.1.50, Dst: 239.255.255.250
User Datagram Protocol, Src Port: 34377, Dst Port: 1900
Simple Service Discovery Protocol

No.     Time           Source                Destination           Protocol Length Info
     69 9.882185       192.168.1.50          239.255.255.250       SSDP     506    NOTIFY * HTTP/1.1 

Frame 69: 506 bytes on wire (4048 bits), 506 bytes captured (4048 bits) on interface 0
Ethernet II, Src: Sfr_25:1a:80 (30:7e:cb:25:1a:80), Dst: IPv4mcast_7f:ff:fa (01:00:5e:7f:ff:fa)
Internet Protocol Version 4, Src: 192.168.1.50, Dst: 239.255.255.250
User Datagram Protocol, Src Port: 34377, Dst Port: 1900
Simple Service Discovery Protocol

No.     Time           Source                Destination           Protocol Length Info
     70 9.889038       192.168.1.50          239.255.255.250       SSDP     539    NOTIFY * HTTP/1.1 

Frame 70: 539 bytes on wire (4312 bits), 539 bytes captured (4312 bits) on interface 0
Ethernet II, Src: Sfr_25:1a:80 (30:7e:cb:25:1a:80), Dst: IPv4mcast_7f:ff:fa (01:00:5e:7f:ff:fa)
Internet Protocol Version 4, Src: 192.168.1.50, Dst: 239.255.255.250
User Datagram Protocol, Src Port: 34377, Dst Port: 1900
Simple Service Discovery Protocol

No.     Time           Source                Destination           Protocol Length Info
     71 9.893846       192.168.1.50          239.255.255.250       SSDP     506    NOTIFY * HTTP/1.1 

Frame 71: 506 bytes on wire (4048 bits), 506 bytes captured (4048 bits) on interface 0
Ethernet II, Src: Sfr_25:1a:80 (30:7e:cb:25:1a:80), Dst: IPv4mcast_7f:ff:fa (01:00:5e:7f:ff:fa)
Internet Protocol Version 4, Src: 192.168.1.50, Dst: 239.255.255.250
User Datagram Protocol, Src Port: 53465, Dst Port: 1900
Simple Service Discovery Protocol

No.     Time           Source                Destination           Protocol Length Info
     72 9.898758       192.168.1.50          239.255.255.250       SSDP     547    NOTIFY * HTTP/1.1 

Frame 72: 547 bytes on wire (4376 bits), 547 bytes captured (4376 bits) on interface 0
Ethernet II, Src: Sfr_25:1a:80 (30:7e:cb:25:1a:80), Dst: IPv4mcast_7f:ff:fa (01:00:5e:7f:ff:fa)
Internet Protocol Version 4, Src: 192.168.1.50, Dst: 239.255.255.250
User Datagram Protocol, Src Port: 53465, Dst Port: 1900
Simple Service Discovery Protocol

No.     Time           Source                Destination           Protocol Length Info
     73 9.906038       192.168.1.50          239.255.255.250       SSDP     535    NOTIFY * HTTP/1.1 

Frame 73: 535 bytes on wire (4280 bits), 535 bytes captured (4280 bits) on interface 0
Ethernet II, Src: Sfr_25:1a:80 (30:7e:cb:25:1a:80), Dst: IPv4mcast_7f:ff:fa (01:00:5e:7f:ff:fa)
Internet Protocol Version 4, Src: 192.168.1.50, Dst: 239.255.255.250
User Datagram Protocol, Src Port: 33924, Dst Port: 1900
Simple Service Discovery Protocol

No.     Time           Source                Destination           Protocol Length Info
     74 9.908329       192.168.1.50          239.255.255.250       SSDP     506    NOTIFY * HTTP/1.1 

Frame 74: 506 bytes on wire (4048 bits), 506 bytes captured (4048 bits) on interface 0
Ethernet II, Src: Sfr_25:1a:80 (30:7e:cb:25:1a:80), Dst: IPv4mcast_7f:ff:fa (01:00:5e:7f:ff:fa)
Internet Protocol Version 4, Src: 192.168.1.50, Dst: 239.255.255.250
User Datagram Protocol, Src Port: 51423, Dst Port: 1900
Simple Service Discovery Protocol

